PubmedID,Title,Publication Date,Non-academic Author(s),Company Affiliation(s),Corresponding Author Email
40717071,Production of SARS-CoV-2 virus-like particles as a vaccine candidate in stable cell lines through inducible E and M protein expression.,2025,"Zheng, Zhaoyue; Ye, JingYa; Dong, Biao","Sichuan Real & Best Biotech Co., Ltd, Chengdu, China.; Sichuan Real & Best Biotech Co., Ltd, Chengdu, China.; Sichuan Real & Best Biotech Co., Ltd, Chengdu, China. biaodong@scu.edu.cn.",biaodong@scu.edu.cn.
40706803,Dynamics of virus-specific CD8+ T cells in the human nasal cavity.,2025,"Hang, Shou Kit","T Cell Diagnostics Pte. Ltd., Singapore.",
40585115,"SARS-CoV-2 antibody immunity across three continents: the West Africa, West Indies, West London Consortium.",2025,"Kwesi-Maliepaard, Eliza Mari; Bediako, Yaw","Yemaachi Biotech, Accra, Ghana.; Yemaachi Biotech, Accra, Ghana.",
40536197,Revolution of AAV in Drug Discovery: From Delivery System to Clinical Application.,2025,"Shang, Yuhua; Jin, Tengchuan","Anhui Genebiol Biotech. Ltd., Hefei, Anhui, China.; Anhui Genebiol Biotech. Ltd., Hefei, Anhui, China.",
40482468,An mRNA vaccine encoding the SARS-CoV-2 Omicron XBB.1.5 receptor-binding domain protects mice from the JN.1 variant.,2025,"Lopes, Tiago J S","Nezu Biotech GmbH, Heidelberg, 69121, Germany.",
40463384,Exploring the standardized detection and sampling methods of human nasal SARS-CoV-2 RBD IgA.,2025,"Jia, Jizong; Li, Na; Wang, Lina; Chu, Jianping; Xu, Henggang","Beijing Wantai Biological Pharmacy Enterprise Co., Ltd, Beijing, China.; Beijing Minhai Biotechnology Co., Ltd., Beijing, China.; Beijing Wantai Biological Pharmacy Enterprise Co., Ltd, Beijing, China.; Beijing Wantai Biological Pharmacy Enterprise Co., Ltd, Beijing, China.; Beijing Wantai Biological Pharmacy Enterprise Co., Ltd, Beijing, China.",
40437463,Adults in Ghana generate higher and more durable neutralising antibody titres following primary course COVID-19 vaccination than matched UK adults: The HERITAGE Study.,2025,"Kwesi-Maliepaard, Eliza Mari; Alhassan, Yakubu; Quaye, Emmanuel K; Kotey, Vera M; Mohammed, Aisha M; Agyemang, Seth; Sromani, Adelaide K; Darko, Stephanie; Buadii, Erica; Tackie, Randy; Akligoh, Harry; Ibrahim, Barikisu; Hutchful, David; Paemka, Lily; Amoako, Emmanuella; Ngoi, Joyce M; Manu, Aida; Bediako, Yaw","Yemaachi Biotech, Accra, Ghana.; Yemaachi Biotech, Accra, Ghana.; Yemaachi Biotech, Accra, Ghana.; Yemaachi Biotech, Accra, Ghana.; Yemaachi Biotech, Accra, Ghana.; Yemaachi Biotech, Accra, Ghana.; Yemaachi Biotech, Accra, Ghana.; Yemaachi Biotech, Accra, Ghana.; Yemaachi Biotech, Accra, Ghana.; Yemaachi Biotech, Accra, Ghana.; Yemaachi Biotech, Accra, Ghana.; Yemaachi Biotech, Accra, Ghana.; Yemaachi Biotech, Accra, Ghana.; Yemaachi Biotech, Accra, Ghana.; Yemaachi Biotech, Accra, Ghana.; Yemaachi Biotech, Accra, Ghana.; Yemaachi Biotech, Accra, Ghana.; Yemaachi Biotech, Accra, Ghana. yaw@yemaachi.com.",yaw@yemaachi.com.
